{
  "schema": "rayman.playwright.windows.v2",
  "scope": "host",
  "browser": "chromium",
  "require": false,
  "timeout_seconds": 120,
  "workspace_root": "/workspace/RaymanAgent",
  "started_at": "2026-03-12T12:00:00+08:00",
  "finished_at": "2026-03-12T12:00:10+08:00",
  "success": false,
  "error": "",
  "error_type": "",
  "error_message": "",
  "script_stack": "",
  "stage": "host-ensure",
  "detail_log": "/workspace/RaymanAgent/.Rayman/logs/playwright.ready.win.sample.log",
  "command_invocation": "pwsh -File ensure_playwright_ready.ps1 -Scope host -Require:$false -Json",
  "host_ps_version": "7.5.0",
  "host_is_windows": true,
  "wsl": {
    "executed": false,
    "success": false,
    "skipped": false,
    "exit_code": null,
    "marker": "/workspace/RaymanAgent/.Rayman/runtime/playwright.ready.wsl.json",
    "detail": "",
    "command": "",
    "failure_kind": "",
    "action_required": ""
  },
  "host": {
    "executed": true,
    "success": false,
    "skipped": false,
    "exit_code": 1,
    "detail": "host playwright install exit=1",
    "command": "npx -y playwright install chromium",
    "failure_kind": "execution_failed",
    "action_required": "host 模式安装/检查 Playwright 失败；请检查网络代理与 npm 源配置后重试。"
  },
  "sandbox": {
    "executed": false,
    "success": false,
    "skipped": false,
    "exit_code": null,
    "status_file": "/workspace/RaymanAgent/.Rayman/runtime/windows-sandbox/status/bootstrap_status.json",
    "log_file": "/workspace/RaymanAgent/.Rayman/runtime/windows-sandbox/status/bootstrap.log",
    "marker": "/workspace/RaymanAgent/.Rayman/runtime/windows-sandbox/status/playwright.ready.sandbox.json",
    "detail": "",
    "guidance": "",
    "failure_kind": "",
    "action_required": "",
    "command": ""
  },
  "proxy": {
    "refresh_attempted": false,
    "refresh_success": false,
    "source": "",
    "snapshot": "/workspace/RaymanAgent/.Rayman/runtime/proxy.resolved.json",
    "bridge": {
      "attempted": false,
      "started": false,
      "skipped": false,
      "keep_running": false,
      "detail": "",
      "listen_port": 0,
      "pid": 0,
      "override_file": "",
      "state_file": "",
      "log_file": ""
    }
  },
  "offline_cache": {
    "attempted": false,
    "success": false,
    "manifest": "/workspace/RaymanAgent/.Rayman/runtime/windows-sandbox/cache/cache_manifest.json",
    "detail": "",
    "cache_ready": false,
    "node_cached": false,
    "playwright_pkg_cached": false,
    "browser_cached": false,
    "reused": false,
    "required": true,
    "missing_components": [
      "node-runtime",
      "npm-offline",
      "ms-playwright"
    ],
    "failure_kind": "offline_cache_incomplete",
    "action_required": "Run .\\.Rayman\\scripts\\pwa\\prepare_windows_sandbox_cache.ps1 on the Windows host until node-runtime, npm-offline, and ms-playwright are all cached, then retry sandbox setup."
  }
}
